{
  "$schema": "../../schemas/art_descriptor.schema.json",
  "id": "core:ember_drake",
  "rig": "core:biped",
  "seed": 7301,
  "palette": { "ramp": "core:ember", "accent": "core:brass" },
  "parts": {
    "head": { "shape": "core:head_drake" },
    "torso": { "shape": "core:torso_carapace" },
    "back": { "shape": "core:wing_membrane" },
    "armL": { "shape": "core:arm_plate", "scale": 0.85 },
    "armR": { "shape": "core:arm_plate", "scale": 0.85 },
    "legL": { "shape": "core:leg_plate" },
    "legR": { "shape": "core:leg_plate" }
  }
}
