{
  "$schema": "../../schemas/art_descriptor.schema.json",
  "_note": "The same pipeline, pointed at a different part set (§15.4). One tileset per floor palette is how floors read differently with no new art.",
  "id": "core:tileset_crypt",
  "type": "tileset",
  "tile": 16,
  "seed": 9104,
  "palette": { "ramp": "core:crypt", "accent": "core:bone" },
  "tiles": [
    { "shape": "core:tile_void" },
    { "shape": "core:tile_floor", "speckle": 16, "speckleFill": "ramp.2" },
    { "shape": "core:tile_floor_alt", "speckle": 6, "speckleFill": "ramp.0" },
    { "shape": "core:tile_wall", "speckle": 14, "speckleFill": "ramp.2" },
    { "shape": "core:tile_door" },
    { "shape": "core:tile_stairs" },
    { "shape": "core:tile_node" }
  ]
}
