{
  "$schema": "../../schemas/art_descriptor.schema.json",
  "id": "core:tomb_knight",
  "rig": "core:biped",
  "seed": 1188,
  "scale": 1.08,
  "palette": { "ramp": "core:iron", "accent": "core:ember" },
  "parts": {
    "head": { "shape": "core:head_helm" },
    "torso": { "shape": "core:torso_plate" },
    "armL": { "shape": "core:arm_plate" },
    "armR": { "shape": "core:arm_plate" },
    "legL": { "shape": "core:leg_plate" },
    "legR": { "shape": "core:leg_plate" }
  }
}
