{
  "$schema": "../../schemas/art_descriptor.schema.json",
  "id": "core:clockwork_page",
  "rig": "core:biped",
  "seed": 3910,
  "scale": 0.92,
  "palette": { "ramp": "core:brass", "accent": "core:arcana" },
  "parts": {
    "head": { "shape": "core:head_orb" },
    "torso": { "shape": "core:torso_plate", "scale": 0.9 },
    "armL": { "shape": "core:arm_plate", "scale": 0.85 },
    "armR": { "shape": "core:arm_plate", "scale": 0.85 },
    "legL": { "shape": "core:leg_plate", "scale": 0.9 },
    "legR": { "shape": "core:leg_plate", "scale": 0.9 }
  }
}
